<!ELEMENT students (student*) >
<!ELEMENT student (name,age,gender) >
<!ELEMENT name (#PCDATA) >
<!ELEMENT age (#PCDATA) >
<!ELEMENT gender (#PCDATA) >
<!ATTLIST student stuId ID #REQUIRED >
